{"artifacts":[{"path":"SKILL.md","sha256":"19a226f9ac33c01a1fd2ad55d2e46c2c6198b2f8673fec86414126b3fae4aa6e"},{"path":"references/build-and-test.md","sha256":"37b086b27de6fc59da7f76b21c857e96277f025c8e5bd6e7d5d51185e54aa0a7"},{"path":"references/delivery.md","sha256":"0b313d75e8ebbafeb958727ddefd3561279556142444c3c5d5f8cbbc54f4f922"},{"path":"references/new-package.md","sha256":"1324eb25657e7e1351063cc27327316c7f04841c467d74289c2b890c998b4541"},{"path":"references/project-docs.md","sha256":"fccbd88588a887a8e026b35edaca3175771090a536346a5a9049115945a60a66"},{"path":"references/skillEvolutionMethod.index.json","sha256":"d99e3efddf4edf24fe41ce5987e304e2615dcd28da21e43fa7cad34f6751bb5b"},{"path":"references/skillEvolutionMethod.md","sha256":"6e050877a03f2a49042a47dadc1fe882655b6fb9efaa15ed6b52498453886be0"},{"path":"references/tools.md","sha256":"78470675a8d6bbb215c85d0e7ab686c39904b8f4a7f1ef05fb9dce34b481eead"},{"path":"scripts/skill-rails-cli/contracts/build-receipt.schema.json","sha256":"284f47334605b6acc9aacf3e86c7f9000c41c9bc72c050f3f97c2b26b2166eea"},{"path":"scripts/skill-rails-cli/contracts/record-exchange.schema.json","sha256":"aeb74547200a989e8236744cd204375870366e10d8a4e35dedb60fd3c7f1dd97"},{"path":"scripts/skill-rails-cli/contracts/source-package.schema.json","sha256":"87322a783b1f1fd7154924daac01159de6ddf4af45aff06d9d03e8cddc748210"},{"path":"scripts/skill-rails-cli/contracts/target.schema.json","sha256":"5a1147d13d0d2c601d2a951f4003e23b1485db4cacd873be63be78171bd348ac"},{"path":"scripts/skill-rails-cli/package.json","sha256":"4c2ab84c418737ee26e6bc9aa4578c04a3ed7a0533bfd2c296c23f880022e9be"},{"path":"scripts/skill-rails-cli/src/core/build.mjs","sha256":"34111f9b0b3468f5265eb81703bfe8f3a766eab25114f908046b4de9ddae255a"},{"path":"scripts/skill-rails-cli/src/core/canonicalize.mjs","sha256":"23dfecc97030793138c7c948f35a2d986c91e3aec37073d7a0506f615a35780d"},{"path":"scripts/skill-rails-cli/src/core/check.mjs","sha256":"94741f823ad75e4042b9d466bafa463d1079462c26de0bbfff57cf86409bd4b5"},{"path":"scripts/skill-rails-cli/src/core/cli.mjs","sha256":"7fc5c165ac6dc38d3b3d3baaa12a2fe945eff047590fca5cf2b566716f067936"},{"path":"scripts/skill-rails-cli/src/core/errors.mjs","sha256":"4ef684ce56015d387be5419607113c5132cd72dbfbd21629f07d6aeed21f8677"},{"path":"scripts/skill-rails-cli/src/core/heading-index.mjs","sha256":"11817e280c818d53842cf9ceead9c2a7ac0fae5dc1d19da0d8a64c32d6d3caf7"},{"path":"scripts/skill-rails-cli/src/core/human-overview.mjs","sha256":"03fdf2eaadc3c1732609596baddf6554e0896c0219948e304b7c835cf501ec71"},{"path":"scripts/skill-rails-cli/src/core/inspect.mjs","sha256":"194b248bbdd8d3645a049aae3e7c482b92722ebd1610e99e454b98e4008db4f7"},{"path":"scripts/skill-rails-cli/src/core/paths.mjs","sha256":"c772af098f3e31a4d74fa2f2af6843063b4665661e65b4b1eb769206594e1f24"},{"path":"scripts/skill-rails-cli/src/core/validate.mjs","sha256":"00c6aeef92d8ea378c7cbfa40105d112a961bd007c61427fe402147dc9396eb8"},{"path":"scripts/skill-rails-cli/src/runtime/common.mjs","sha256":"93b89ce7b60bdf2853b7ed8c16ce75c64fcd062165e45ec084b425d11c8795df"},{"path":"scripts/skill-rails-cli/src/runtime/exchange.mjs","sha256":"a72c78940d0ed1ae0dce3dfc59188526c3e63266c4784576807ab0604bc08cfb"},{"path":"scripts/skill-rails-cli/src/runtime/initialize-record.mjs","sha256":"e064d247076adb44127590119314a32a56fa6e41cd1f48bf1d7ddf201833ca34"},{"path":"scripts/skill-rails-cli/src/runtime/integrity.mjs","sha256":"7abd65221ed4273f78a72480891dd3fa290ef42178cbcafd04425e615c9f5198"},{"path":"scripts/skill-rails-cli/src/runtime/record.mjs","sha256":"0626d8dad1358b94bff8f18fe2efc89b68ab4f525addc0ef95b734a9830c90bb"},{"path":"scripts/skill-rails-cli/src/runtime/run-record.mjs","sha256":"10cc146fc6a30179fe3a9bf26b9389517ecbc4e7988b2f2c02f15999aa734708"}],"coreVersion":"2.0.2","imports":["skillEvolutionMethod"],"packageId":"skill-rails-authoring","packageVersion":"2.0.2","schemaVersion":1,"sources":[{"id":"source-package","path":"authoring-package.json","sha256":"4d2165e94789897f6706856e4ff66f6257731e4adad48685588cdae6dc95672b"},{"id":"entry","path":"authoring/skill-rails/SKILL.source.md","sha256":"9b538f6b0610060ef639a6b320331d4e5836e395118a54117f0b1b17c528d37d"},{"id":"reference:build-and-test.md","path":"authoring/skill-rails/build-and-test.md","sha256":"37b086b27de6fc59da7f76b21c857e96277f025c8e5bd6e7d5d51185e54aa0a7"},{"id":"reference:delivery.md","path":"authoring/skill-rails/delivery.md","sha256":"0b313d75e8ebbafeb958727ddefd3561279556142444c3c5d5f8cbbc54f4f922"},{"id":"reference:new-package.md","path":"authoring/skill-rails/new-package.md","sha256":"1324eb25657e7e1351063cc27327316c7f04841c467d74289c2b890c998b4541"},{"id":"reference:project-docs.md","path":"authoring/skill-rails/project-docs.md","sha256":"fccbd88588a887a8e026b35edaca3175771090a536346a5a9049115945a60a66"},{"id":"target:skill-rails","path":"authoring/skill-rails/targets/authoring/target.json","sha256":"c82f86ef0c341a2e136d66014f81aa6c8240a3a65db236316323fd7c0e2ac268"},{"id":"reference:tools.md","path":"authoring/skill-rails/tools.md","sha256":"78470675a8d6bbb215c85d0e7ab686c39904b8f4a7f1ef05fb9dce34b481eead"},{"id":"embedded-core-tooling:scripts/skill-rails-cli/contracts/build-receipt.schema.json","path":"contracts/build-receipt.schema.json","sha256":"284f47334605b6acc9aacf3e86c7f9000c41c9bc72c050f3f97c2b26b2166eea"},{"id":"embedded-core-tooling:scripts/skill-rails-cli/contracts/record-exchange.schema.json","path":"contracts/record-exchange.schema.json","sha256":"aeb74547200a989e8236744cd204375870366e10d8a4e35dedb60fd3c7f1dd97"},{"id":"embedded-core-tooling:scripts/skill-rails-cli/contracts/source-package.schema.json","path":"contracts/source-package.schema.json","sha256":"87322a783b1f1fd7154924daac01159de6ddf4af45aff06d9d03e8cddc748210"},{"id":"embedded-core-tooling:scripts/skill-rails-cli/contracts/target.schema.json","path":"contracts/target.schema.json","sha256":"5a1147d13d0d2c601d2a951f4003e23b1485db4cacd873be63be78171bd348ac"},{"id":"module:skillEvolutionMethod","path":"docs/guide/ai-skill-evolution-method_ko.md","sha256":"6e050877a03f2a49042a47dadc1fe882655b6fb9efaa15ed6b52498453886be0"},{"id":"embedded-core-tooling:scripts/skill-rails-cli/package.json","path":"package.json","sha256":"4c2ab84c418737ee26e6bc9aa4578c04a3ed7a0533bfd2c296c23f880022e9be"},{"id":"embedded-core-tooling:scripts/skill-rails-cli/src/core/build.mjs","path":"src/core/build.mjs","sha256":"34111f9b0b3468f5265eb81703bfe8f3a766eab25114f908046b4de9ddae255a"},{"id":"embedded-core-tooling:scripts/skill-rails-cli/src/core/canonicalize.mjs","path":"src/core/canonicalize.mjs","sha256":"23dfecc97030793138c7c948f35a2d986c91e3aec37073d7a0506f615a35780d"},{"id":"embedded-core-tooling:scripts/skill-rails-cli/src/core/check.mjs","path":"src/core/check.mjs","sha256":"94741f823ad75e4042b9d466bafa463d1079462c26de0bbfff57cf86409bd4b5"},{"id":"embedded-core-tooling:scripts/skill-rails-cli/src/core/cli.mjs","path":"src/core/cli.mjs","sha256":"7fc5c165ac6dc38d3b3d3baaa12a2fe945eff047590fca5cf2b566716f067936"},{"id":"embedded-core-tooling:scripts/skill-rails-cli/src/core/errors.mjs","path":"src/core/errors.mjs","sha256":"4ef684ce56015d387be5419607113c5132cd72dbfbd21629f07d6aeed21f8677"},{"id":"embedded-core-tooling:scripts/skill-rails-cli/src/core/heading-index.mjs","path":"src/core/heading-index.mjs","sha256":"11817e280c818d53842cf9ceead9c2a7ac0fae5dc1d19da0d8a64c32d6d3caf7"},{"id":"embedded-core-tooling:scripts/skill-rails-cli/src/core/human-overview.mjs","path":"src/core/human-overview.mjs","sha256":"03fdf2eaadc3c1732609596baddf6554e0896c0219948e304b7c835cf501ec71"},{"id":"embedded-core-tooling:scripts/skill-rails-cli/src/core/inspect.mjs","path":"src/core/inspect.mjs","sha256":"194b248bbdd8d3645a049aae3e7c482b92722ebd1610e99e454b98e4008db4f7"},{"id":"embedded-core-tooling:scripts/skill-rails-cli/src/core/paths.mjs","path":"src/core/paths.mjs","sha256":"c772af098f3e31a4d74fa2f2af6843063b4665661e65b4b1eb769206594e1f24"},{"id":"embedded-core-tooling:scripts/skill-rails-cli/src/core/validate.mjs","path":"src/core/validate.mjs","sha256":"00c6aeef92d8ea378c7cbfa40105d112a961bd007c61427fe402147dc9396eb8"},{"id":"embedded-core-tooling:scripts/skill-rails-cli/src/runtime/common.mjs","path":"src/runtime/common.mjs","sha256":"93b89ce7b60bdf2853b7ed8c16ce75c64fcd062165e45ec084b425d11c8795df"},{"id":"embedded-core-tooling:scripts/skill-rails-cli/src/runtime/exchange.mjs","path":"src/runtime/exchange.mjs","sha256":"a72c78940d0ed1ae0dce3dfc59188526c3e63266c4784576807ab0604bc08cfb"},{"id":"embedded-core-tooling:scripts/skill-rails-cli/src/runtime/initialize-record.mjs","path":"src/runtime/initialize-record.mjs","sha256":"e064d247076adb44127590119314a32a56fa6e41cd1f48bf1d7ddf201833ca34"},{"id":"embedded-core-tooling:scripts/skill-rails-cli/src/runtime/integrity.mjs","path":"src/runtime/integrity.mjs","sha256":"7abd65221ed4273f78a72480891dd3fa290ef42178cbcafd04425e615c9f5198"},{"id":"embedded-core-tooling:scripts/skill-rails-cli/src/runtime/record.mjs","path":"src/runtime/record.mjs","sha256":"0626d8dad1358b94bff8f18fe2efc89b68ab4f525addc0ef95b734a9830c90bb"},{"id":"embedded-core-tooling:scripts/skill-rails-cli/src/runtime/run-record.mjs","path":"src/runtime/run-record.mjs","sha256":"10cc146fc6a30179fe3a9bf26b9389517ecbc4e7988b2f2c02f15999aa734708"}],"targetId":"skill-rails","treeSha256":"108f3b4fec2802476009f78e5765cc3be05914265cd91e328d505da083aead8e"}
